{"attributes":{"episode_id":"episode:synthetic-review","purpose":"demonstration only","revision_status":"PROPOSED_NOT_AUTHORIZED","synthetic":true},"edges":[{"attributes":{},"confidence":null,"evidence_ids":["ev:scenario"],"id":"edge:01","predicate":"requires","source":"mission:readiness","status":"asserted","target":"capability:intake","valid_from":null,"valid_to":null},{"attributes":{},"confidence":null,"evidence_ids":["ev:scenario"],"id":"edge:02","predicate":"depends_on","source":"capability:intake","status":"asserted","target":"claim:current","valid_from":null,"valid_to":null},{"attributes":{},"confidence":null,"evidence_ids":["ev:report"],"id":"edge:03","predicate":"supported_by","source":"claim:current","status":"asserted","target":"evidence:report","valid_from":null,"valid_to":null},{"attributes":{},"confidence":null,"evidence_ids":["ev:scenario"],"id":"edge:04","predicate":"depends_on","source":"claim:current","status":"asserted","target":"assumption:standard","valid_from":null,"valid_to":null},{"attributes":{},"confidence":null,"evidence_ids":["ev:scenario"],"id":"edge:05","predicate":"depends_on","source":"decision:publish","status":"asserted","target":"claim:current","valid_from":null,"valid_to":null},{"attributes":{},"confidence":null,"evidence_ids":["ev:scenario"],"id":"edge:06","predicate":"implements","source":"decision:publish","status":"asserted","target":"policy:review","valid_from":null,"valid_to":null},{"attributes":{},"confidence":null,"evidence_ids":["ev:scenario"],"id":"edge:07","predicate":"authorized_by","source":"policy:review","status":"asserted","target":"authority:reviewer","valid_from":null,"valid_to":null},{"attributes":{},"confidence":null,"evidence_ids":["ev:scenario"],"id":"edge:08","predicate":"relates_to","source":"event:review","status":"asserted","target":"decision:publish","valid_from":null,"valid_to":null},{"attributes":{},"confidence":null,"evidence_ids":["ev:scenario"],"id":"edge:09","predicate":"authorized_by","source":"decision:publish","status":"asserted","target":"authority:reviewer","valid_from":null,"valid_to":null}],"evidence":[{"attributes":{},"id":"ev:report","locator":"Synthetic review report, section 2","sha256":null,"source":"synthetic://cartography/review-report","valid_from":"2026-09-01T00:00:00.000000Z","valid_to":"2026-11-01T00:00:00.000000Z"},{"attributes":{},"id":"ev:scenario","locator":"Explicit synthetic scenario authored for tests","sha256":null,"source":"synthetic://cartography/example","valid_from":null,"valid_to":null}],"id":"atlas:synthetic-review","nodes":[{"attributes":{},"confidence":null,"evidence_ids":["ev:scenario"],"id":"assumption:standard","kind":"assumption","label":"Review standard remains applicable","layer":"meaning","review_due":"2026-11-01T00:00:00.000000Z","scope":"default","status":"asserted","valid_from":null,"valid_to":null},{"attributes":{},"confidence":null,"evidence_ids":[],"id":"authority:reviewer","kind":"authority","label":"Designated review role","layer":"authority","review_due":null,"scope":"default","status":"asserted","valid_from":null,"valid_to":null},{"attributes":{},"confidence":null,"evidence_ids":[],"id":"capability:intake","kind":"capability","label":"Evidence intake process","layer":"operations","review_due":null,"scope":"default","status":"asserted","valid_from":null,"valid_to":null},{"attributes":{},"confidence":null,"evidence_ids":[],"id":"claim:current","kind":"claim","label":"The assessment has current evidence","layer":"meaning","review_due":null,"scope":"default","status":"asserted","valid_from":null,"valid_to":null},{"attributes":{},"confidence":null,"evidence_ids":[],"id":"claim:unknown","kind":"claim","label":"Additional source coverage is unknown","layer":"meaning","review_due":null,"scope":"default","status":"unknown","valid_from":null,"valid_to":null},{"attributes":{},"confidence":null,"evidence_ids":["ev:scenario"],"id":"decision:publish","kind":"decision","label":"Proposed assessment publication","layer":"decisions","review_due":null,"scope":"default","status":"asserted","valid_from":null,"valid_to":null},{"attributes":{},"confidence":null,"evidence_ids":["ev:scenario"],"id":"event:review","kind":"event","label":"Review window opened","layer":"events","review_due":null,"scope":"default","status":"observed","valid_from":null,"valid_to":null},{"attributes":{},"confidence":null,"evidence_ids":["ev:report"],"id":"evidence:report","kind":"evidence","label":"Recorded review report","layer":"evidence","review_due":null,"scope":"default","status":"asserted","valid_from":null,"valid_to":null},{"attributes":{},"confidence":null,"evidence_ids":[],"id":"mission:readiness","kind":"mission","label":"Prepare a readiness review","layer":"mission","review_due":null,"scope":"default","status":"asserted","valid_from":null,"valid_to":null},{"attributes":{},"confidence":null,"evidence_ids":[],"id":"policy:review","kind":"policy","label":"Review procedure","layer":"policy","review_due":null,"scope":"default","status":"asserted","valid_from":null,"valid_to":null}],"predicates":[{"dependency":"forward","description":"Source records a reference to an authority; not a verified grant.","evidence_relation":false,"id":"authorized_by","label":"Authority reference","source_kinds":[],"target_kinds":["authority","authority_slice","role"]},{"dependency":"none","description":"A contradiction has been recorded; this is not a text inference.","evidence_relation":false,"id":"contradicts","label":"Recorded contradiction","source_kinds":[],"target_kinds":[]},{"dependency":"forward","description":"Source depends on target.","evidence_relation":false,"id":"depends_on","label":"Depends on","source_kinds":[],"target_kinds":[]},{"dependency":"forward","description":"Source representation derives from target.","evidence_relation":true,"id":"derived_from","label":"Derived from","source_kinds":[],"target_kinds":[]},{"dependency":"reverse","description":"Source evidence relates to target.","evidence_relation":true,"id":"evidence_of","label":"Evidence of","source_kinds":[],"target_kinds":[]},{"dependency":"forward","description":"Source records implementation of target.","evidence_relation":false,"id":"implements","label":"Implements","source_kinds":[],"target_kinds":[]},{"dependency":"forward","description":"Source records an informational input from target.","evidence_relation":true,"id":"informed_by","label":"Informed by","source_kinds":[],"target_kinds":[]},{"dependency":"none","description":"Source is represented as a part of target.","evidence_relation":false,"id":"part_of","label":"Part of","source_kinds":[],"target_kinds":[]},{"dependency":"none","description":"Source records production of target.","evidence_relation":false,"id":"produced","label":"Produced","source_kinds":[],"target_kinds":[]},{"dependency":"none","description":"A declared relationship without dependency semantics.","evidence_relation":false,"id":"relates_to","label":"Related to","source_kinds":[],"target_kinds":[]},{"dependency":"forward","description":"Source requires target.","evidence_relation":false,"id":"requires","label":"Requires","source_kinds":[],"target_kinds":[]},{"dependency":"none","description":"Source records succession of target; no automatic retraction.","evidence_relation":false,"id":"supersedes","label":"Supersedes","source_kinds":[],"target_kinds":[]},{"dependency":"forward","description":"Source cites target as support.","evidence_relation":true,"id":"supported_by","label":"Supported by","source_kinds":[],"target_kinds":[]},{"dependency":"reverse","description":"Source supports target.","evidence_relation":true,"id":"supports","label":"Supports","source_kinds":[],"target_kinds":[]}],"schema":"deepsigma.cartography/1","title":"Synthetic administrative review | DEEP SIGMA CARTOGRAPHY"}
